{
  "id": "test-app",
  "name": "Test App",
  "description": "Minimal test manifest.",
  "tier": "long-tail",
  "uniqueness": "parity",
  "why_rome": "test",
  "categories": [
    "yield"
  ],
  "status": "live",
  "owner": {
    "team": "rome-core",
    "contact": "maintainer@example.com"
  },
  "chain": {
    "rome_chain_id": 200200,
    "contract_address": "0x0000000000000000000000000000000000000001"
  },
  "urls": {
    "app": "https://example.invalid/app",
    "docs": "https://example.invalid/docs",
    "source": "https://example.invalid/source"
  },
  "capabilities": [
    {
      "name": "ping",
      "kind": "query",
      "description": "returns pong",
      "inputs": {
        "type": "object"
      },
      "outputs": {
        "type": "object"
      },
      "abi": "function ping() view returns (string)",
      "abi_hash": "0x0000000000000000000000000000000000000000000000000000000000000000",
      "cu_estimate": 1000
    }
  ],
  "surfaces": {
    "mcp_tools": [
      "test_app.ping"
    ],
    "manifest_url": "https://explorer.rome.builders/manifests/test-app.json",
    "rest_base": "/apps/test-app"
  },
  "tags": [],
  "signature": {
    "alg": "ed25519",
    "pubkey": "6881e3b2f2ed333f5a28a2a538614a39deae39574c19bcb2dbcc49870e495aee",
    "value": "8ec39694158af7c7c21ce0cf99841e5a7b736802f5e8f9da63e0aabc1a5e92e9f384139931263675c848b458586859d35d7a84025dd28cf2901063cac163db00"
  }
}