{
  "id": "test-app",
  "name": "Test App",
  "description": "Minimal test manifest.",
  "icon_url": "https://example.invalid/icon.svg",
  "tier": "long-tail",
  "uniqueness": "parity",
  "why_rome": "test",
  "categories": ["yield", "derivatives"],
  "status": "live",
  "owner": { "team": "rome-core", "contact": "maintainer@example.com" },
  "chain": { "rome_chain_id": 200200, "contract_address": "0x0000000000000000000000000000000000000001" },
  "solana_programs": ["So11111111111111111111111111111111111111112"],
  "urls": {
    "app": "https://example.invalid/app",
    "docs": "https://example.invalid/docs",
    "source": "https://example.invalid/source"
  },
  "capabilities": [
    {
      "name": "ping",
      "kind": "query",
      "description": "returns pong",
      "inputs": { "type": "object" },
      "outputs": { "type": "object" },
      "abi": "function ping() view returns (string)",
      "abi_hash": "0x0000000000000000000000000000000000000000000000000000000000000000",
      "cu_estimate": 1000,
      "example_call": { "vault": "0xabc", "amount": "100" }
    },
    {
      "name": "deposit",
      "kind": "execute",
      "description": "deposits funds",
      "inputs": { "type": "object" },
      "outputs": { "type": "object" },
      "abi": "function deposit(uint256) returns (bool)",
      "abi_hash": "0x0000000000000000000000000000000000000000000000000000000000000000",
      "cu_estimate": 50000
    }
  ],
  "surfaces": {
    "mcp_tools": ["test_app.ping"],
    "manifest_url": "https://cardo.rome.builders/manifests/test-app.json",
    "rest_base": "/apps/test-app"
  },
  "tags": ["test", "fully-populated"],
  "metrics_cache": {
    "tx_7d": 0,
    "unique_callers_7d": 0,
    "agent_share_7d": 0.0,
    "gas_usd_7d": 0,
    "checked_at": "2026-04-21T00:00:00Z"
  },
  "signature": {
    "alg": "ed25519",
    "pubkey": "0000000000000000000000000000000000000000000000000000000000000000",
    "value": "00000000000000000000000000000000000000000000000000000000000000000000000000000000000000000000000000000000000000000000000000000000"
  }
}
